{
    "$schema": "http://json-schema.org/draft-07/schema#",
    "type": "object",
    "required": ["submission_prefix", "logs"],
    "additionalProperties": false,
    "properties": {
        "logging_level": {"type": "string", "enum": ["trace", "debug", "info", "warn", "error"]},
        "submission_prefix": {"type": "string"},
        "enable_chrome_cosigners": {"type": "boolean", "default": true},
        "chrome_cosigner_realms": {"type": "array", "items": {"type": "string"}, "uniqueItems": true, "default": []},
        "witness": {"$ref": "#/definitions/identity"},
        "mirror": {"$ref": "#/definitions/mirror"},
        "logs": {
            "type": "object",
            "description": "Source logs keyed by exact checkpoint origin.",
            "propertyNames": {"pattern": "^[^+\\s]+$"},
            "additionalProperties": {
                "type": "object",
                "required": ["checkpoint_signers"],
                "additionalProperties": false,
                "properties": {
                    "description": {"type": "string"},
                    "checkpoint_signers": {
                        "type": "array",
                        "minItems": 1,
                        "items": {
                            "type": "object",
                            "required": ["name", "algorithm", "public_key"],
                            "additionalProperties": false,
                            "properties": {
                                "name": {"type": "string", "pattern": "^[^+\\s]+$"},
                                "algorithm": {"type": "string", "enum": ["ed25519", "subtree/v1"]},
                                "public_key": {"type": "string", "description": "Base64 DER SubjectPublicKeyInfo."}
                            }
                        }
                    }
                }
            }
        }
    },
    "anyOf": [
        {"required": ["witness"]},
        {"required": ["mirror"]}
    ],
    "definitions": {
        "identity": {
            "type": "object",
            "required": ["name", "monitoring_prefix"],
            "additionalProperties": false,
            "properties": {
                "name": {"type": "string", "pattern": "^[^+\\s]+$"},
                "description": {"type": "string"},
                "monitoring_prefix": {"type": "string"}
            }
        },
        "mirror": {
            "type": "object",
            "required": ["name", "monitoring_prefix"],
            "additionalProperties": false,
            "properties": {
                "name": {"type": "string", "pattern": "^[^+\\s]+$"},
                "description": {"type": "string"},
                "monitoring_prefix": {"type": "string"},
                "clean_interval_secs": {"type": "integer", "minimum": 1, "default": 3600},
                "commit_packages": {"type": "integer", "minimum": 1, "maximum": 1024, "default": 32},
                "max_chunk_bytes": {"type": "integer", "minimum": 1, "default": 16777216}
            }
        }
    }
}
