{
    "logging_level": "info",
    "submission_prefix": "http://localhost:8787/",
    "chrome_cosigner_realms": ["UNTRUSTED_VALIDATION_ONLY"],
    "witness": {
        "name": "dev.witness.example",
        "description": "Local-dev witness for smoke testing",
        "monitoring_prefix": "https://witness.dev.example/"
    },
    "mirror": {
        "name": "oid/1.3.6.1.4.1.44363.48.2",
        "description": "Local-dev mirror for smoke testing",
        "monitoring_prefix": "https://mirror.dev.example/",
        "clean_interval_secs": 5,
        "commit_packages": 2
    },
    "logs": {
        "oid/1.3.6.1.4.1.44363.48.1.0.1": {
            "description": "Dev-only IETF MTC issuance log.",
            "checkpoint_signers": [
                {
                    "name": "oid/1.3.6.1.4.1.44363.48.1",
                    "algorithm": "subtree/v1",
                    "public_key": "MIIFMjALBglghkgBZQMEAxEDggUhALhF+iiBQHpZGDBxYpsIIjEoEWAU+1j/a7TIyf4Zz1sL13sWZIo0T/5Ia8Pjy1+rmrxMwvHDSQFpK+xdKQ2BWmzffpcQoziCR6fgNxYVUHpXLJg15nN78wuSp5b/86EKcwx7VQkk6x+21WGV8C3m03RvnzML6+mQyQxNZ2rUFfQmjS1rVIqLzfJ/3UZ+Z0nA+Htx6Fwnl2lHcruojU8awGx8DpF4ZHLNdjU3CNa7xcKOnbiRw5QOh5BS0wyP0Qlly7juG9ebBg03+4OQmFUqq906V6scaoKwkR0c8UhlSqVhOwcBSyHkoRgrSlUBZx0RL1l1+wyKKsRdV13EL0iXf/N//0IdsnxF55+KlHIAcCPfC2QgXNn1fALOnR9h8q4k9xOfVkGYTujfeDuepD6ZfG4Z0J4GKvylbk92qquPZmAPx49qtPZ4VpDRhYFu41qTlFi2AyTu/GDmSxH6DSAxestsspqgPHdfFRZylSaJ+k+Pg4Mpy55tyZRbbHreTntmNXj4fTk18qFSIJetUEKg2ZCmKFELYQPLJCzYo6/Bpa2lIzH030YbwdpR0dIkCU56vtPYfZjw2BcIR4DugDcPOXYx7LddQmS2teLmbAWGtft0NRY5kWWDeg/f98YTTwM7+mnBskFpZcbleFkvQOJYy237KfuOD1Q1W24kpl9nq64xk9AHEVzAuf+Uy5Eak7GnbA52YvXisgE54BWe2SnLky1IlfiaAuVcWd8tu49uXdfVsfPOw3tKkWazgcVEDiPmc2jN4KKdWaoFo8m+JKTcjddb4w6CvGNdNqrGbeiAxnAamH1+BfDy/yh4KL7DBZUInYq5qjkO1xnKpuV2zbvpsYSjIuXi2rtpwjzGltVPwy/1cAG2tk4qg38wYtha61CzUQ9+38NN844IPU2blP+rDeFdc9mvMLnzHMT0HJwk8tYYsqfDxL37dF1S0+tUWJyL2orAXa0U7HRFBVdaCYjuxlHBcVQ5/fspkjOApDwaZqhsmCqEHxGCCmoOHi8v/1EI7K5Rpqq8m5SSJtIo/4TE5eXWMRTYA1nEkx5hLc7Rg4t9BmrJGCzs+iI6IaTI4VWu+ngDc7zBUJiu5AwDOvIvjnxnoNJSbadHXoMDCMBK7Z0yvMxy5xnucKjRPwmsEeJuojfVzI+Yta4OVPkzvQUHlC7ZANBW/TL45ugXd5Ev1IJ0YCm3HM47ppuPwtA+tEECfDh7wvlQMaCucFIhXrJLnqj7CpYbD4C/qA0NYlfBwitQjF0xuX/N/h0XZuipyHcZMt1Zitt+cXdD9F/FcfIeSlFiSfgddH8VMpeQ8PcKC45GGk7fUFBK8D8w3fiogY44dh4Wgdbd7wsd0yay7CKM5IVw8oW0nSnXwu83hm1URt+CuOQ7NMskiWKiGpo5RhWXQPiu6Oahak6ytC0UP+JhLgXvS15kbYEySERFVqKov5LOELrey2uKQLCA3ULVM0b+/MS5tAseSZiZHsdTyVqi8qUG8xHnELDx02wdymZE7m0dSunOpWZu9LPoiNvbuVp37P4ei0d958sHY51oLVMCDsFOpsfdfnFTidEJOEKfq4oGihRmpM2JE1n4B04PWhQq3XMbh4eNmF5Ppuyztz0phVNBgnPpUDqoQJLAgOXykC+Q9cWZRNJMoCcdEdDWc0YG0DlVCjf8orc1hQ5j9UDy8Gt5FEtcTtLHALtRwz0mWz0Dc4nJnv1ZdkLYKdsetYZDz80H9N7GC49yfZe9fEtZvaE="
                }
            ]
        },
        "oid/1.3.6.1.4.1.32473.2.0.1": {
            "description": "Dev-only MTC issuance log used by the mirror integration suite.",
            "checkpoint_signers": [
                {
                    "name": "oid/1.3.6.1.4.1.32473.2",
                    "algorithm": "subtree/v1",
                    "public_key": "MIIFMjALBglghkgBZQMEAxEDggUhAMUP9YKtqA5Sb9kyZi1dJLMWSNEae05DELoJsDcc9tCh/dmDLuE4GPlVMYk9LkspRWBVHVLBrrlAeQjxth+7tyL42ecaETWNo2bVNTEWkMPY9OdLXHbYXTOHOCu7moIYutMK5MBKE3JvaqGJO+wXmeOINWHDGYHC1uNNc2zB5LTTLLqjrewynvFtggXpuVnZnIHZespFVFnoHIx5kL843uNedlUk5VBTGXYyZJsb1gHyFs11IaTguPiBLQpxhclDAMEfSdZfzC1rdirvO+3RhTVbRCEFd8bz724ExTEcubEY/x8e7kzs1E4X+Rnw8GBXgzN8A9NaoZOd3Mo8ID84Z3/UeoZyg3Y7gkmiNn40Y4S7IdCFwLcohJQWzrt/nLKTxtJUh7TbwyUIhmXjqYJkcRD5M+WxZbG+oH5Xm47XVYHTRmfDq5JJCz5K033kcoNxx8IhQJlK7hbmsDw3J6GAoAK7iu4Spbb/gjpYWKusnVYsjGRcDSr3Slp3r4z0+7WwZtWaQsNY/dg0kWIRuyprnBeacaw/GMfI2AeKIFcCe6tpYCWpY7IUC2+qvVg1L+YbwEiOIoqTQ466Mbp9tJOBWfro3dVNu2j3IwEa7pBUCeqtZFwVWiQqRKQ2wnpltTsEFaEGyOMxJTVvt2vROYftncrsoMHq3m1Yd8UN9UBFNtx18LNYEHFa0Mfsh1WcuYy333dSQ+0P/xRfSoFabNhJJ7KPJHeHuFGS+fHTv2VVsi2IiS8NTmd/8Q6DiSxA1s3wcp4oRZz5qA6o0ryXj2yXj+f64xOf+OqhFbmLsExwGWbBwnLZv3cd2AEydlD8Gzqy0x8XjCRt0/NNb8gXdaYCpe+42VQO8rcQK05qzVnxJ+XPaB2cY1DupWLtyqnUCEU9+Ua1oOds1HVCLiCVBCNCZz1hqfcqs1qGWedfg82i5SEKEn0h3mSRgLCMu/bGwlHny9p7GIXxZbj6GTOWf6EFevigS5l5q5j+KQgb1ujkTJCC6B1EdPHMwCbF9RKImvwZioWPwlHUcvfKxvJSDqryUbPVlJp5HuW4LljW0SmocMYPxumRQYrdxRHSMPEKqEtFOC5eenuiGnIpRvarKkHLF2vePK3j4HHE9yxpr8nXbWAyiJIo8NMnXjC+03QYdB7mobWVWfraLZhCHE60X31xb+p/VGsCweYV6FWkyJBm6z616savZr4M4BVBG/1PULRUNstdNSS/N/4ljzF3u6S3/lZj2ox2biN84cHKra80RLj5CNfnHko/kM8TPFHOAYm+KVFnoypdrYcOMzHW5hdBBemx7isREdqzzVkt3AUKCKLuXHITsOIJu3BtsvN1YX5VaFkQ/RxKAqZv4QXOvRJafW1hJ5zbYlh5KWKoGG8kRNVych7WiwY/+zi0SSw3vJznszqkQMUKkwptrLAZzpFHUztXxkBAqPkXGJ/8XuThA8VCT0IfbmfaHABnuR/KM+M4AdZUq+cJ/BJcaeXGl2vueFtaQrQiuEh3x0H4iHlOu3LIbCDRuUyMIUdJ7uwTtkB+WJFUKDiIYAfUKsWmYEtCBiR5dD5WRwCVlEnJmfYLTWuxAq6cE8V3pkOggotP/U6UKArfLn8JOt+i0CR96C2zMY1aG365ULSXT9QQ/P3u03ogg2y01cUoolz3Ges2D0nhwv0h7x4lBp+d10kFxPSoL7bXujHTQNSqn5zzpWNgijUi3xXAFCh14C0frEW4jRLst3v0mIUNIYi9/LDy41mhkSA="
                }
            ]
        },
        "example.com/log1": {
            "description": "Dev-only ordinary Ed25519 transparency log.",
            "checkpoint_signers": [
                {
                    "name": "example.com/log1",
                    "algorithm": "ed25519",
                    "public_key": "MCowBQYDK2VwAyEAzdnT3CQc3ag2fmKnO1ntodIm0wfsymDkK89IOrHKLWc="
                }
            ]
        },
        "example.com/witness-log": {
            "description": "Dev-only source used by the witness integration suite.",
            "checkpoint_signers": [
                {
                    "name": "example.com/witness-log",
                    "algorithm": "ed25519",
                    "public_key": "MCowBQYDK2VwAyEAzdnT3CQc3ag2fmKnO1ntodIm0wfsymDkK89IOrHKLWc="
                }
            ]
        }
    }
}
