{
    "logging_level": "info",
    "submission_prefix": "http://localhost:8788/",
    "witness": {
        "name": "dev.witness.example",
        "description": "Standalone local-dev witness",
        "monitoring_prefix": "http://localhost:8788/"
    },
    "logs": {
        "example.com/witness-log": {
            "checkpoint_signers": [
                {
                    "name": "example.com/witness-log",
                    "algorithm": "ed25519",
                    "public_key": "MCowBQYDK2VwAyEAzdnT3CQc3ag2fmKnO1ntodIm0wfsymDkK89IOrHKLWc="
                }
            ]
        }
    }
}
